{
  "protocol_version": 1,
  "request_id": "demo-route-001",
  "site_id": "runtime:task-route",
  "definition_ref": {
    "id": "task-route",
    "definition_revision": "6015a48e00c0c99a3e208c21e3d4d92431e8c2c22a446805c5db7f50eca9b5d5"
  },
  "state": {
    "task": "Investigate a failing validator test"
  },
  "policy_id": "task-route-demo",
  "timeout_ms": 1500
}
